[
  {
    "id": "phase3-001",
    "category": "plugin",
    "label": "plugin/config conflict",
    "severity": "HIGH",
    "priority": "P1",
    "affectedComponent": "Plugin loader",
    "evidenceLines": [
      "[Server thread/ERROR]: Failed to load plugin BadJar v1.0",
      "java.util.zip.ZipException: invalid CEN header"
    ],
    "safeFirstStep": "Stop accepting players, snapshot `plugins/BadJar`, and replace the corrupted jar before restarting.",
    "likelyCause": "Corrupted plugin jar file triggered by a bad upload.",
    "customerMessage": "BadJar couldn't load because its jar is corrupted; I'm replacing it with a known-good build before restarting.",
    "evidenceToCollect": [
      "`ls -l plugins/BadJar`",
      "Bugged jar checksum",
      "`docker compose logs wingcraft-paper`"
    ],
    "escalate": false,
    "resolutionNotes": "Swapped in a fresh jar; the plugin loads cleanly afterward."
  },
  {
    "id": "phase3-002",
    "category": "plugin",
    "label": "plugin/config conflict",
    "severity": "MEDIUM",
    "priority": "P2",
    "affectedComponent": "Plugin loader",
    "evidenceLines": [
      "Loading plugin LegacyNetBridge v2.3.1",
      "java.lang.NoClassDefFoundError: io.netty.channel.ChannelFuture"
    ],
    "safeFirstStep": "Stop the server, snapshot `plugins/LegacyNetBridge` and bundled libs, and deploy a build targeting the current Paper API.",
    "likelyCause": "Plugin bundles Netty 4.0 while Paper already removed the referenced class.",
    "customerMessage": "LegacyNetBridge references an old Netty class; I'm matching the plugin build to the running server before restarting.",
    "evidenceToCollect": [
      "`sha256sum plugins/LegacyNetBridge/libs/netty-4.0.0.jar`",
      "Paper jar version (`cat paperclip.jar.version`)",
      "Plugin release notes"
    ],
    "escalate": false,
    "resolutionNotes": "Rebuilt the plugin against Paper's Netty; the NoClassDefFoundError disappears."
  },
  {
    "id": "phase3-003",
    "category": "plugin",
    "label": "plugin/config conflict",
    "severity": "MEDIUM",
    "priority": "P2",
    "affectedComponent": "Plugin config",
    "evidenceLines": [
      "java.lang.IllegalArgumentException: Expected Boolean",
      "Loading plugin ChunkGuard v3.4"
    ],
    "safeFirstStep": "Stop the server, back up `plugins/ChunkGuard/config.yml`, and revert the invalid setting or let the plugin regenerate defaults.",
    "likelyCause": "Malformed YAML in ChunkGuard's config prevented it from parsing new fields.",
    "customerMessage": "ChunkGuard's config contains an invalid Boolean; I'm restoring the previous config before starting.",
    "evidenceToCollect": [
      "`cat plugins/ChunkGuard/config.yml`",
      "Plugin log around the IllegalArgumentException",
      "`paper.yml` plugin list"
    ],
    "escalate": false,
    "resolutionNotes": "Corrected the config syntax; ChunkGuard loads successfully afterward."
  },
  {
    "id": "phase3-004",
    "category": "startup",
    "label": "startup error",
    "severity": "HIGH",
    "priority": "P1",
    "affectedComponent": "PaperMC JVM",
    "evidenceLines": [
      "[Server thread/ERROR]: Encountered an error during world load",
      "java.net.BindException: Cannot assign requested address"
    ],
    "safeFirstStep": "Stop the JVM, change `server-ip` to `0.0.0.0` or blank, and restart so the container can bind.",
    "likelyCause": "`server-ip` is hard-coded to a host-local address that the container cannot reach.",
    "customerMessage": "The configured server-ip can't bind inside the container; I'm clearing it before we restart.",
    "evidenceToCollect": [
      "`grep server-ip server.properties`",
      "`ip addr show` inside the container",
      "`docker compose logs paper`"
    ],
    "escalate": false,
    "resolutionNotes": "Reset `server-ip` to blank; server binds successfully on the bridge interface."
  },
  {
    "id": "phase3-005",
    "category": "infrastructure",
    "label": "likely infrastructure issue",
    "severity": "CRITICAL",
    "priority": "P0",
    "affectedComponent": "Host network",
    "evidenceLines": [
      "[Server thread/WARN]: Failed to bind to port 25565",
      "Address already in use"
    ],
    "safeFirstStep": "Drain traffic, run `ss -tulpn | grep 25565`, and identify the legacy process holding the port before restarting.",
    "likelyCause": "Another host-level service is already listening on 25565, so Paper can't bind.",
    "customerMessage": "Port 25565 is occupied by another process; I'm stopping that process before the server comes online.",
    "evidenceToCollect": [
      "`ss -tulpn | grep 25565`",
      "`docker compose ps` to ensure no duplicate containers",
      "Host firewall/syslog entries"
    ],
    "escalate": true,
    "resolutionNotes": "Stopped the conflicting service, confirmed the port was free, and restarted the server."
  },
  {
    "id": "phase3-006",
    "category": "startup",
    "label": "startup error",
    "severity": "HIGH",
    "priority": "P1",
    "affectedComponent": "PaperMC startup script",
    "evidenceLines": [
      "Error: Unable to access jarfile /data/paper-server-old.jar",
      "[init script] Starting server with NO_FILE permission"
    ],
    "safeFirstStep": "Stop the wrapper, correct the jar path (or rename the file), and restart once permissions check out.",
    "likelyCause": "Wrapper still points to an outdated `paper-server-old.jar` that no longer exists.",
    "customerMessage": "The startup script refers to a jar that isn't there; I'm updating the path before retrying.",
    "evidenceToCollect": [
      "`ls -l /opt/paper`",
      "Startup wrapper contents",
      "Recent `journalctl` entries for the service"
    ],
    "escalate": false,
    "resolutionNotes": "Renamed the jar/matched the script; the server starts without issues."
  },
  {
    "id": "phase3-007",
    "category": "startup",
    "label": "startup error",
    "severity": "HIGH",
    "priority": "P1",
    "affectedComponent": "PaperMC JVM",
    "evidenceLines": [
      "java.lang.UnsupportedClassVersionError: com/example/Main has been compiled by a more recent version of the Java Runtime (class file version 61.0)",
      "This server requires Java 17"
    ],
    "safeFirstStep": "Stop the service, point the wrapper to Java 17, and rerun `java -version` before restarting.",
    "likelyCause": "Startup script still invokes Java 11 while Paper requires Java 17.",
    "customerMessage": "Paper needs Java 17; I'm switching the runtime before bringing it back online.",
    "evidenceToCollect": [
      "`/opt/java11/bin/java -version`",
      "`ls -l /opt/java*`",
      "Full `commands` line from the failed start"
    ],
    "escalate": true,
    "resolutionNotes": "Repointed to Java 17; the UnsupportedClassVersionError disappears."
  },
  {
    "id": "phase3-008",
    "category": "configuration",
    "label": "version mismatch",
    "severity": "HIGH",
    "priority": "P1",
    "affectedComponent": "World storage",
    "evidenceLines": [
      "This world was saved with Minecraft 1.20.4",
      "This server supports up to 1.19.4"
    ],
    "safeFirstStep": "Stop the container, collect `world/level.dat` and `paper.yml` target version, and coordinate with the team owning the newer release before downgrading.",
    "likelyCause": "World files come from a newer release than the server binary supports.",
    "customerMessage": "The world uses 1.20.4 format; I'll align the server/world before restarting.",
    "evidenceToCollect": [
      "`file world/level.dat`",
      "`grep target-version paper.yml`",
      "`tar czf world-backup.tar.gz world`"
    ],
    "escalate": false,
    "resolutionNotes": "Rolled the server back to 1.20.4 or exported the world for the newer release; load succeeds once versions match."
  },
  {
    "id": "phase3-009",
    "category": "plugin",
    "label": "plugin/config conflict",
    "severity": "MEDIUM",
    "priority": "P2",
    "affectedComponent": "Plugin loader",
    "evidenceLines": [
      "[Server thread/ERROR]: Detected circular dependency between LoopHook and LoopHook",
      "Loading plugin LoopHook v1.0"
    ],
    "safeFirstStep": "Stop the server, remove one of the circularly-dependent plugins from `plugins/`, and restart.",
    "likelyCause": "LoopHook is configured to load-after itself, creating a dependency cycle.",
    "customerMessage": "LoopHook declares a circular dependency, so I'm isolating one of the plugins before restarting.",
    "evidenceToCollect": [
      "`plugins/LoopHook/plugin.yml`",
      "`cat plugins/LoopHook/load-order.log`",
      "Stack trace around the circular dependency"
    ],
    "escalate": false,
    "resolutionNotes": "Adjusted the plugin metadata; Paper loads without the loop."
  },
  {
    "id": "phase3-010",
    "category": "startup",
    "label": "startup error",
    "severity": "HIGH",
    "priority": "P1",
    "affectedComponent": "PaperMC config",
    "evidenceLines": [
      "Paper encountered an error while reading paper.yml",
      "[Server thread/INFO]: Reloading server (attempt 2/5) after fatal config error"
    ],
    "safeFirstStep": "Halt the container, restore a clean `paper.yml`, and only restart after confirming the file loads without repeated loops.",
    "likelyCause": "Corrupted `paper.yml` confuses Paper and triggers a restart loop.",
    "customerMessage": "The config file is corrupted; I'm restoring a sane copy before retrying.",
    "evidenceToCollect": [
      "`cat paper.yml`",
      "`md5sum paper.yml`",
      "Server restart log tail"
    ],
    "escalate": true,
    "resolutionNotes": "Replaced `paper.yml` with the clean template; the server stops looping and starts successfully."
  },
  {
    "id": "phase3-011",
    "category": "startup",
    "label": "startup error",
    "severity": "MEDIUM",
    "priority": "P2",
    "affectedComponent": "Startup wrapper",
    "evidenceLines": [